{
  "schema_version": "0.1",
  "connection_id": "conn-hybrid-quic",
  "profile_ref": "transport-tls13-hybrid@0.1.0",
  "transport_mode": "quic",
  "quic_version": "v2",
  "tls_version": "TLS1.3",
  "offered_group_ids": [
    "X25519MLKEM768"
  ],
  "selected_group_id": "X25519MLKEM768",
  "selected_cipher_suite": "TLS_AES_256_GCM_SHA384",
  "alpn": "h3",
  "fresh_key_share_verified": true,
  "session_resumed": false,
  "psk_key_exchange_mode": "none",
  "early_data_used": false,
  "zero_rtt_application_profile_applied": false,
  "zero_rtt_replay_protection_verified": false,
  "server_certificate_chain_validated": true,
  "server_reference_identifier": "api.example.test",
  "expected_reference_identifier": "api.example.test",
  "reference_identifier_match": true,
  "common_name_fallback_used": false,
  "certificate_currently_valid": true,
  "certificate_signature_algorithm_id": "ALG-ECDSA-P256-SHA256",
  "trust_model": "public-web-pki",
  "client_certificate_requested": false,
  "client_certificate_present": false,
  "client_certificate_validated": false,
  "client_identity_authorized": false,
  "hybrid_to_classical_fallback_occurred": false,
  "obsolete_prestandard_kyber_group_used": false,
  "transport_key_exchange_pq_protected": true,
  "pq_authentication_claimed_from_transport": false,
  "application_e2ee_terminated_or_decrypted_by_transport": false
}
